--
-- ROWNUM
-- Test Oracle ROWNUM pseudocolumn functionality
--
-- Setup test data
CREATE TABLE rownum_test (
    id int,
    name varchar(50),
    value int
);
INSERT INTO rownum_test VALUES
    (1, 'Alice', 100),
    (2, 'Bob', 200),
    (3, 'Charlie', 150),
    (4, 'David', 300),
    (5, 'Eve', 250),
    (6, 'Frank', 175),
    (7, 'Grace', 225),
    (8, 'Henry', 125),
    (9, 'Iris', 275),
    (10, 'Jack', 190);
--
-- Basic ROWNUM queries
--
-- ROWNUM <= N (should use LIMIT optimization)
SELECT id, name FROM rownum_test WHERE ROWNUM <= 5;
 id |  name   
----+---------
  1 | Alice
  2 | Bob
  3 | Charlie
  4 | David
  5 | Eve
(5 rows)

-- ROWNUM = 1 (should use LIMIT 1)
SELECT id, name FROM rownum_test WHERE ROWNUM = 1;
 id | name  
----+-------
  1 | Alice
(1 row)

-- ROWNUM < N (should use LIMIT N-1)
SELECT id, name FROM rownum_test WHERE ROWNUM < 4;
 id |  name   
----+---------
  1 | Alice
  2 | Bob
  3 | Charlie
(3 rows)

-- ROWNUM in SELECT list
SELECT ROWNUM, id, name FROM rownum_test WHERE ROWNUM <= 3;
 rownum | id |  name   
--------+----+---------
      1 |  1 | Alice
      2 |  2 | Bob
      3 |  3 | Charlie
(3 rows)

--
-- ROWNUM with ORDER BY
-- (requires subquery pattern to order first, then limit)
--
-- Top-N by value (descending)
SELECT * FROM (
    SELECT id, name, value
    FROM rownum_test
    ORDER BY value DESC
) WHERE ROWNUM <= 3;
 id | name  | value 
----+-------+-------
  4 | David |   300
  9 | Iris  |   275
  5 | Eve   |   250
(3 rows)

-- Top-N by name (ascending)
SELECT * FROM (
    SELECT id, name
    FROM rownum_test
    ORDER BY name
) WHERE ROWNUM <= 5;
 id |  name   
----+---------
  1 | Alice
  2 | Bob
  3 | Charlie
  4 | David
  5 | Eve
(5 rows)

-- ROWNUM = 1 with ORDER BY (get minimum)
SELECT * FROM (
    SELECT id, name, value
    FROM rownum_test
    ORDER BY value
) WHERE ROWNUM = 1;
 id | name  | value 
----+-------+-------
  1 | Alice |   100
(1 row)

--
-- ROWNUM in nested subqueries
--
-- Subquery with ROWNUM in WHERE clause
SELECT name FROM (
    SELECT id, name FROM rownum_test WHERE ROWNUM <= 7
) sub WHERE id > 3;
 name  
-------
 David
 Eve
 Frank
 Grace
(4 rows)

-- Multiple levels of ROWNUM
SELECT * FROM (
    SELECT * FROM (
        SELECT id, name FROM rownum_test WHERE ROWNUM <= 8
    ) WHERE ROWNUM <= 5
) WHERE ROWNUM <= 3;
 id |  name   
----+---------
  1 | Alice
  2 | Bob
  3 | Charlie
(3 rows)

--
-- ROWNUM with JOINs
--
CREATE TABLE dept (
    dept_id int,
    dept_name varchar(50)
);
INSERT INTO dept VALUES
    (1, 'Engineering'),
    (2, 'Sales'),
    (3, 'Marketing');
-- Update test data to include dept_id
ALTER TABLE rownum_test ADD COLUMN dept_id int;
UPDATE rownum_test SET dept_id = (id % 3) + 1;
-- ROWNUM with JOIN
SELECT e.id, e.name, d.dept_name
FROM (SELECT * FROM rownum_test WHERE ROWNUM <= 5) e
JOIN dept d ON e.dept_id = d.dept_id
ORDER BY e.id;
 id |  name   |  dept_name  
----+---------+-------------
  1 | Alice   | Sales
  2 | Bob     | Marketing
  3 | Charlie | Engineering
  4 | David   | Sales
  5 | Eve     | Marketing
(5 rows)

-- JOIN with ORDER BY and ROWNUM
SELECT * FROM (
    SELECT e.id, e.name, e.value, d.dept_name
    FROM rownum_test e
    JOIN dept d ON e.dept_id = d.dept_id
    ORDER BY e.value DESC
) WHERE ROWNUM <= 4;
 id | name  | value |  dept_name  
----+-------+-------+-------------
  4 | David |   300 | Sales
  9 | Iris  |   275 | Engineering
  5 | Eve   |   250 | Marketing
  7 | Grace |   225 | Sales
(4 rows)

--
-- Edge cases and non-optimizable patterns
--
-- ROWNUM > 0 (tautology, returns all rows - Oracle semantics)
SELECT COUNT(*) FROM rownum_test WHERE ROWNUM > 0;
 count 
-------
    10
(1 row)

-- ROWNUM >= 1 (tautology, returns all rows - Oracle semantics)
SELECT COUNT(*) FROM rownum_test WHERE ROWNUM >= 1;
 count 
-------
    10
(1 row)

-- ROWNUM > N where N >= 1 (returns empty - Oracle semantics)
SELECT id, name FROM rownum_test WHERE ROWNUM > 5;
 id | name 
----+------
(0 rows)

SELECT COUNT(*) FROM rownum_test WHERE ROWNUM > 1;
 count 
-------
     0
(1 row)

-- ROWNUM >= N where N > 1 (returns empty - Oracle semantics)
SELECT id, name FROM rownum_test WHERE ROWNUM >= 2;
 id | name 
----+------
(0 rows)

SELECT COUNT(*) FROM rownum_test WHERE ROWNUM >= 2;
 count 
-------
     0
(1 row)

-- ROWNUM = 0 (always false)
SELECT id, name FROM rownum_test WHERE ROWNUM = 0;
 id | name 
----+------
(0 rows)

-- ROWNUM = 2 (not optimizable, returns empty - Oracle semantics)
SELECT id, name FROM rownum_test WHERE ROWNUM = 2;
 id | name 
----+------
(0 rows)

-- ROWNUM = 3 (not optimizable, returns empty - Oracle semantics)
SELECT id, name FROM rownum_test WHERE ROWNUM = 3;
 id | name 
----+------
(0 rows)

-- ROWNUM with negative number
SELECT id, name FROM rownum_test WHERE ROWNUM <= -1;
 id | name 
----+------
(0 rows)

-- ROWNUM in complex WHERE clause (AND)
SELECT id, name FROM rownum_test WHERE ROWNUM <= 5 AND id > 2;
 id |  name   
----+---------
  3 | Charlie
  4 | David
  5 | Eve
  6 | Frank
  7 | Grace
(5 rows)

-- ROWNUM in complex WHERE clause (OR - not optimizable)
SELECT id, name FROM rownum_test WHERE ROWNUM <= 3 OR id = 10;
 id |  name   
----+---------
  1 | Alice
  2 | Bob
  3 | Charlie
 10 | Jack
(4 rows)

--
-- ROWNUM with DISTINCT
--
SELECT DISTINCT dept_id FROM rownum_test WHERE ROWNUM <= 6;
 dept_id 
---------
       3
       2
       1
(3 rows)

--
-- ROWNUM with aggregate functions
--
-- ROWNUM with GROUP BY (applied before grouping)
SELECT dept_id, COUNT(*)
FROM (SELECT * FROM rownum_test WHERE ROWNUM <= 7)
GROUP BY dept_id
ORDER BY dept_id;
 dept_id | count 
---------+-------
       1 |     2
       2 |     3
       3 |     2
(3 rows)

--
-- Issue #12: ROWNUM with same-level ORDER BY, DISTINCT, GROUP BY, aggregation
-- These should NOT be transformed to LIMIT because of semantic differences
--
-- Direct COUNT with ROWNUM (should count only first 5 rows, not all rows)
SELECT COUNT(*) FROM rownum_test WHERE ROWNUM <= 5;
 count 
-------
     5
(1 row)

-- Direct ORDER BY with ROWNUM (should pick first 5 rows, THEN sort them)
-- NOT the same as "ORDER BY value LIMIT 5" which sorts all rows first
SELECT id, name, value FROM rownum_test WHERE ROWNUM <= 5 ORDER BY value;
 id |  name   | value 
----+---------+-------
  1 | Alice   |   100
  3 | Charlie |   150
  2 | Bob     |   200
  5 | Eve     |   250
  4 | David   |   300
(5 rows)

-- Direct DISTINCT with ROWNUM (should DISTINCT over first 3 rows only)
-- NOT the same as "SELECT DISTINCT ... LIMIT 3" which distincts all rows first
CREATE TABLE rownum_distinct_test (category varchar(10));
INSERT INTO rownum_distinct_test VALUES ('A'), ('A'), ('B'), ('B'), ('C'), ('C');
SELECT DISTINCT category FROM rownum_distinct_test WHERE ROWNUM <= 3;
 category 
----------
 B
 A
(2 rows)

DROP TABLE rownum_distinct_test;
-- Direct GROUP BY with ROWNUM (should group only first 4 rows)
-- NOT the same as "GROUP BY ... LIMIT N" which groups all rows first
CREATE TABLE rownum_group_test (category varchar(10), amount int);
INSERT INTO rownum_group_test VALUES
    ('A', 10), ('A', 20), ('B', 30), ('B', 40), ('C', 50), ('C', 60);
SELECT category, SUM(amount)
FROM rownum_group_test
WHERE ROWNUM <= 4
GROUP BY category
ORDER BY category;
 category | sum 
----------+-----
 A        |  30
 B        |  70
(2 rows)

DROP TABLE rownum_group_test;
--
-- Verify optimizer transformation with EXPLAIN
--
-- Should show Limit node for ROWNUM <= N
EXPLAIN (COSTS OFF) SELECT id, name FROM rownum_test WHERE ROWNUM <= 5;
          QUERY PLAN           
-------------------------------
 Limit
   ->  Seq Scan on rownum_test
(2 rows)

-- Should show Limit node for ROWNUM = 1
EXPLAIN (COSTS OFF) SELECT id, name FROM rownum_test WHERE ROWNUM = 1;
          QUERY PLAN           
-------------------------------
 Limit
   ->  Seq Scan on rownum_test
(2 rows)

-- Should show Limit node for ROWNUM < N
EXPLAIN (COSTS OFF) SELECT id, name FROM rownum_test WHERE ROWNUM < 4;
          QUERY PLAN           
-------------------------------
 Limit
   ->  Seq Scan on rownum_test
(2 rows)

-- Subquery pattern should show Limit node
EXPLAIN (COSTS OFF)
SELECT * FROM (
    SELECT id, name, value
    FROM rownum_test
    ORDER BY value DESC
) WHERE ROWNUM <= 3;
                QUERY PLAN                
------------------------------------------
 Limit
   ->  Sort
         Sort Key: rownum_test.value DESC
         ->  Seq Scan on rownum_test
(4 rows)

-- ROWNUM > 0 (tautology, should remove qual entirely)
EXPLAIN (COSTS OFF) SELECT COUNT(*) FROM rownum_test WHERE ROWNUM > 0;
          QUERY PLAN           
-------------------------------
 Aggregate
   ->  Seq Scan on rownum_test
(2 rows)

-- ROWNUM >= 1 (tautology, should remove qual entirely)
EXPLAIN (COSTS OFF) SELECT COUNT(*) FROM rownum_test WHERE ROWNUM >= 1;
          QUERY PLAN           
-------------------------------
 Aggregate
   ->  Seq Scan on rownum_test
(2 rows)

-- ROWNUM > 5 (should show One-Time Filter: false)
EXPLAIN (COSTS OFF) SELECT id, name FROM rownum_test WHERE ROWNUM > 5;
        QUERY PLAN        
--------------------------
 Result
   One-Time Filter: false
(2 rows)

-- ROWNUM > 1 with aggregation (should show One-Time Filter: false)
EXPLAIN (COSTS OFF) SELECT COUNT(*) FROM rownum_test WHERE ROWNUM > 1;
           QUERY PLAN           
--------------------------------
 Aggregate
   ->  Result
         One-Time Filter: false
(3 rows)

-- ROWNUM >= 2 (should show One-Time Filter: false)
EXPLAIN (COSTS OFF) SELECT id, name FROM rownum_test WHERE ROWNUM >= 2;
        QUERY PLAN        
--------------------------
 Result
   One-Time Filter: false
(2 rows)

-- ROWNUM = 2 should NOT be optimized to LIMIT (should show One-Time Filter: false)
EXPLAIN (COSTS OFF) SELECT id, name FROM rownum_test WHERE ROWNUM = 2;
        QUERY PLAN        
--------------------------
 Result
   One-Time Filter: false
(2 rows)

-- Issue #12: These should NOT show Limit because of same-level operations
-- Direct COUNT with ROWNUM (has aggregation, should not use LIMIT)
EXPLAIN (COSTS OFF) SELECT COUNT(*) FROM rownum_test WHERE ROWNUM <= 5;
          QUERY PLAN           
-------------------------------
 Aggregate
   ->  Seq Scan on rownum_test
         Filter: (ROWNUM <= 5)
(3 rows)

-- Direct ORDER BY with ROWNUM (has ORDER BY, should not use LIMIT)
EXPLAIN (COSTS OFF) SELECT id, name FROM rownum_test WHERE ROWNUM <= 5 ORDER BY value;
          QUERY PLAN           
-------------------------------
 Sort
   Sort Key: value
   ->  Seq Scan on rownum_test
         Filter: (ROWNUM <= 5)
(4 rows)

-- Direct DISTINCT with ROWNUM (has DISTINCT, should not use LIMIT)
EXPLAIN (COSTS OFF) SELECT DISTINCT dept_id FROM rownum_test WHERE ROWNUM <= 5;
          QUERY PLAN           
-------------------------------
 HashAggregate
   Group Key: dept_id
   ->  Seq Scan on rownum_test
         Filter: (ROWNUM <= 5)
(4 rows)

--
-- ROWNUM with other clauses
--
-- ROWNUM with OFFSET (not standard Oracle, but test interaction)
SELECT id, name FROM rownum_test WHERE ROWNUM <= 5 OFFSET 2;
 id |  name   
----+---------
  3 | Charlie
  4 | David
  5 | Eve
  6 | Frank
  7 | Grace
(5 rows)

-- ROWNUM with FETCH FIRST (should work together)
SELECT id, name FROM rownum_test WHERE ROWNUM <= 8 FETCH FIRST 3 ROWS ONLY;
 id |  name   
----+---------
  1 | Alice
  2 | Bob
  3 | Charlie
(3 rows)

--
-- ROWNUM in SELECT list with ORDER BY (Issue: ORDER BY bug fix)
-- These test the fix for ROWNUM being evaluated at wrong level when combined with ORDER BY
--
-- Basic case: ROWNUM in SELECT with ORDER BY
-- ROWNUM values should reflect row position BEFORE sort, not after
SELECT * FROM (
    SELECT ROWNUM as rn, id, name, value
    FROM rownum_test
    ORDER BY value DESC
) sub WHERE rn <= 3;
 rn | id |  name   | value 
----+----+---------+-------
  2 |  2 | Bob     |   200
  3 |  3 | Charlie |   150
  1 |  1 | Alice   |   100
(3 rows)

-- Verify ROWNUM values are assigned before ORDER BY (not sequential 1,2,3)
SELECT ROWNUM as rn, id, name, value
FROM rownum_test
ORDER BY value DESC;
 rn | id |  name   | value 
----+----+---------+-------
  4 |  4 | David   |   300
  9 |  9 | Iris    |   275
  5 |  5 | Eve     |   250
  7 |  7 | Grace   |   225
  2 |  2 | Bob     |   200
 10 | 10 | Jack    |   190
  6 |  6 | Frank   |   175
  3 |  3 | Charlie |   150
  8 |  8 | Henry   |   125
  1 |  1 | Alice   |   100
(10 rows)

-- ROWNUM in SELECT with ORDER BY and outer filter
SELECT * FROM (
    SELECT ROWNUM as rn, id, name, value
    FROM rownum_test
    ORDER BY value DESC
) sub WHERE rn > 2 AND rn <= 5;
 rn | id |  name   | value 
----+----+---------+-------
  4 |  4 | David   |   300
  5 |  5 | Eve     |   250
  3 |  3 | Charlie |   150
(3 rows)

-- Multiple ROWNUM columns at different nesting levels
SELECT ROWNUM as outer_rn, * FROM (
    SELECT ROWNUM as middle_rn, * FROM (
        SELECT ROWNUM as inner_rn, id, name, value
        FROM rownum_test
        ORDER BY value DESC
    ) sub1
    ORDER BY value ASC
) sub2
ORDER BY id
LIMIT 5;
 outer_rn | middle_rn | inner_rn | id |  name   | value 
----------+-----------+----------+----+---------+-------
        1 |        10 |        1 |  1 | Alice   |   100
        6 |         5 |        2 |  2 | Bob     |   200
        3 |         8 |        3 |  3 | Charlie |   150
       10 |         1 |        4 |  4 | David   |   300
        8 |         3 |        5 |  5 | Eve     |   250
(5 rows)

-- ROWNUM in SELECT with ORDER BY and JOIN
SELECT * FROM (
    SELECT ROWNUM as rn, e.id, e.name, e.value, d.dept_name
    FROM rownum_test e
    JOIN dept d ON e.dept_id = d.dept_id
    ORDER BY e.value DESC
) sub WHERE rn <= 4;
 rn | id |  name   | value |  dept_name  
----+----+---------+-------+-------------
  3 |  4 | David   |   300 | Sales
  3 |  9 | Iris    |   275 | Engineering
  3 |  5 | Eve     |   250 | Marketing
  3 |  7 | Grace   |   225 | Sales
  3 |  2 | Bob     |   200 | Marketing
  3 | 10 | Jack    |   190 | Sales
  3 |  6 | Frank   |   175 | Engineering
  3 |  3 | Charlie |   150 | Engineering
  3 |  8 | Henry   |   125 | Marketing
  3 |  1 | Alice   |   100 | Sales
(10 rows)

-- Test that ROWNUM is materialized (not re-evaluated in outer query)
-- This tests the materialization fix
SELECT rn, id, name FROM (
    SELECT ROWNUM as rn, id, name, value
    FROM rownum_test
    ORDER BY value DESC
) sub
ORDER BY rn  -- Sorting by rn should not re-evaluate ROWNUM
LIMIT 5;
 rn | id |  name   
----+----+---------
  1 |  1 | Alice
  2 |  2 | Bob
  3 |  3 | Charlie
  4 |  4 | David
  5 |  5 | Eve
(5 rows)

-- EXPLAIN: Verify ROWNUM is pushed to scan level before Sort
EXPLAIN (COSTS OFF, VERBOSE)
SELECT * FROM (
    SELECT ROWNUM as rn, id, name, value
    FROM rownum_test
    ORDER BY value DESC
) sub WHERE rn <= 3;
                                       QUERY PLAN                                        
-----------------------------------------------------------------------------------------
 Subquery Scan on sub
   Output: sub.rn, sub.id, sub.name, sub.value
   Filter: (sub.rn <= 3)
   ->  Result
         Output: (ROWNUM), rownum_test.id, rownum_test.name, rownum_test.value
         ->  Sort
               Output: rownum_test.id, rownum_test.name, rownum_test.value, (ROWNUM)
               Sort Key: rownum_test.value DESC
               ->  Seq Scan on public.rownum_test
                     Output: rownum_test.id, rownum_test.name, rownum_test.value, ROWNUM
(10 rows)

--
-- Issue #14: ROWNUM counter reset in correlated subqueries
-- ROWNUM counter must reset to 0 for each correlated subquery invocation.
-- This matches Oracle behavior where each subquery execution starts fresh.
-- Bug report: https://github.com/rophy/IvorySQL/issues/14
--
SELECT
    id,
    name,
    (SELECT ROWNUM FROM (
        SELECT * FROM rownum_test t2
        WHERE t2.id = t1.id
        ORDER BY value DESC
    ) sub) as correlated_rn
FROM rownum_test t1
ORDER BY id
LIMIT 5;
 id |  name   | correlated_rn 
----+---------+---------------
  1 | Alice   |             1
  2 | Bob     |             1
  3 | Charlie |             1
  4 | David   |             1
  5 | Eve     |             1
(5 rows)

-- Additional test: max ROWNUM in correlated subquery
-- Each group should have max_rn = 3 (not incrementing values)
SELECT
    id,
    (SELECT MAX(ROWNUM) FROM rownum_test t2 WHERE t2.id = t1.id) as max_rn
FROM rownum_test t1
WHERE id <= 5
GROUP BY id
ORDER BY id;
 id | max_rn 
----+--------
  1 |      1
  2 |      1
  3 |      1
  4 |      1
  5 |      1
(5 rows)

-- Test multiple correlated subqueries in same query
-- Both should reset independently
SELECT
    id,
    (SELECT COUNT(*) FROM rownum_test t2 WHERE t2.id = t1.id AND ROWNUM <= 2) as cnt_first_2,
    (SELECT MIN(ROWNUM) FROM rownum_test t2 WHERE t2.id = t1.id) as min_rn
FROM rownum_test t1
WHERE id <= 3
GROUP BY id
ORDER BY id;
 id | cnt_first_2 | min_rn 
----+-------------+--------
  1 |           1 |      1
  2 |           1 |      1
  3 |           1 |      1
(3 rows)

-- Nested correlated subqueries
-- Inner and outer subqueries should both reset ROWNUM
SELECT
    id,
    (SELECT
        (SELECT ROWNUM FROM rownum_test t3 WHERE t3.id = t2.id ORDER BY value LIMIT 1)
     FROM rownum_test t2 WHERE t2.id = t1.id LIMIT 1) as nested_rn
FROM rownum_test t1
WHERE id <= 3
ORDER BY id;
 id | nested_rn 
----+-----------
  1 |         1
  2 |         1
  3 |         1
(3 rows)

-- Correlated subquery with ROWNUM in JOIN condition
SELECT
    t1.id,
    (SELECT COUNT(*)
     FROM rownum_test t2
     JOIN rownum_test t3 ON t2.id = t3.id
     WHERE t2.id = t1.id AND ROWNUM <= 1) as join_count
FROM rownum_test t1
WHERE id <= 3
GROUP BY id
ORDER BY id;
 id | join_count 
----+------------
  1 |          0
  2 |          0
  3 |          0
(3 rows)

--
-- Nested ROWNUM expression tests (CodeRabbit improvements)
--
-- ROWNUM in arithmetic expressions with ORDER BY
SELECT
    id,
    value,
    ROWNUM * 10 as rownum_x10,
    ROWNUM + value as rownum_plus_value
FROM rownum_test
WHERE id <= 5
ORDER BY value DESC;
 id | value | rownum_x10 | rownum_plus_value 
----+-------+------------+-------------------
  4 |   300 |         40 |               304
  5 |   250 |         50 |               255
  2 |   200 |         20 |               202
  3 |   150 |         30 |               153
  1 |   100 |         10 |               101
(5 rows)

-- ROWNUM in CASE expression with ORDER BY
SELECT
    id,
    value,
    CASE
        WHEN ROWNUM <= 2 THEN 'Top 2'
        WHEN ROWNUM <= 5 THEN 'Top 5'
        ELSE 'Other'
    END as tier
FROM rownum_test
ORDER BY value DESC
LIMIT 7;
 id | value | tier  
----+-------+-------
  4 |   300 | Top 5
  9 |   275 | Other
  5 |   250 | Top 5
  7 |   225 | Other
  2 |   200 | Top 2
 10 |   190 | Other
  6 |   175 | Other
(7 rows)

-- ROWNUM in function calls with ORDER BY
SELECT
    id,
    value,
    COALESCE(ROWNUM, 0) as coalesced_rn,
    GREATEST(ROWNUM, 1) as greatest_rn
FROM rownum_test
WHERE id <= 5
ORDER BY value;
 id | value | coalesced_rn | greatest_rn 
----+-------+--------------+-------------
  1 |   100 | 1            |           1
  3 |   150 | 3            |           3
  2 |   200 | 2            |           2
  5 |   250 | 5            |           5
  4 |   300 | 4            |           4
(5 rows)

-- Multiple nested ROWNUM expressions in same SELECT
SELECT
    id,
    ROWNUM as rn1,
    ROWNUM * 2 as rn2,
    CASE WHEN ROWNUM <= 3 THEN ROWNUM * 100 ELSE 0 END as rn3
FROM rownum_test
WHERE id <= 5
ORDER BY value DESC;
 id | rn1 | rn2 | rn3 
----+-----+-----+-----
  4 |   4 |   8 |   0
  5 |   5 |  10 |   0
  2 |   2 |   4 | 200
  3 |   3 |   6 | 300
  1 |   1 |   2 | 100
(5 rows)

-- ROWNUM in subquery expression with ORDER BY
SELECT
    id,
    value,
    (SELECT ROWNUM) as subquery_rn,
    ROWNUM + (SELECT 10) as expr_rn
FROM rownum_test
WHERE id <= 5
ORDER BY value;
 id | value | subquery_rn | expr_rn 
----+-------+-------------+---------
  1 |   100 |           1 |      11
  3 |   150 |           1 |      13
  2 |   200 |           1 |      12
  5 |   250 |           1 |      15
  4 |   300 |           1 |      14
(5 rows)

-- ROWNUM in aggregate function with ORDER BY
SELECT
    dept_id,
    MAX(ROWNUM) as max_rownum,
    MIN(ROWNUM) as min_rownum,
    COUNT(ROWNUM) as count_rownum
FROM (
    SELECT dept_id, ROWNUM
    FROM rownum_test
    ORDER BY value DESC
) sub
GROUP BY dept_id
ORDER BY dept_id;
 dept_id | max_rownum | min_rownum | count_rownum 
---------+------------+------------+--------------
       1 |          8 |          2 |            3
       2 |         10 |          1 |            4
       3 |          9 |          3 |            3
(3 rows)

--
-- Projection capability tests (change_plan_targetlist usage)
--
-- Test ROWNUM with Material node (non-projection-capable)
SELECT DISTINCT ON (dept_id)
    dept_id,
    ROWNUM as rn,
    value
FROM rownum_test
ORDER BY dept_id, value DESC;
 dept_id | rn | value 
---------+----+-------
       1 | 10 |   275
       2 | 10 |   300
       3 | 10 |   250
(3 rows)

-- Test ROWNUM with Sort -> Unique pipeline
SELECT DISTINCT
    ROWNUM as rn,
    dept_id
FROM (
    SELECT dept_id, ROWNUM
    FROM rownum_test
    ORDER BY value DESC
) sub
WHERE ROWNUM <= 5;
 rn | dept_id 
----+---------
  5 |       2
  2 |       3
  3 |       3
  4 |       1
  1 |       2
(5 rows)

-- Test ROWNUM with SetOp (non-projection-capable)
-- With UNION ROWNUM fix, each branch has independent ROWNUM (Oracle behavior)
SELECT ROWNUM as rn, id FROM rownum_test WHERE id <= 3
UNION
SELECT ROWNUM as rn, id FROM rownum_test WHERE id > 7
ORDER BY rn, id;
 rn | id 
----+----
  1 |  1
  1 |  8
  2 |  2
  2 |  9
  3 |  3
  3 | 10
(6 rows)

--
-- Edge cases for ROWNUM reset
--
-- ROWNUM in EXISTS correlated subquery
SELECT
    id,
    EXISTS(SELECT 1 FROM rownum_test t2 WHERE t2.id = t1.id AND ROWNUM = 1) as has_first
FROM rownum_test t1
WHERE id <= 5
ORDER BY id;
 id | has_first 
----+-----------
  1 | t
  2 | t
  3 | t
  4 | t
  5 | t
(5 rows)

-- ROWNUM in NOT EXISTS correlated subquery
SELECT
    id,
    NOT EXISTS(SELECT 1 FROM rownum_test t2 WHERE t2.id = t1.id AND ROWNUM > 5) as all_within_5
FROM rownum_test t1
WHERE id <= 3
ORDER BY id;
 id | all_within_5 
----+--------------
  1 | t
  2 | t
  3 | t
(3 rows)

-- ROWNUM in IN correlated subquery
SELECT
    id,
    1 IN (SELECT ROWNUM FROM rownum_test t2 WHERE t2.id = t1.id) as has_rownum_1
FROM rownum_test t1
WHERE id <= 3
ORDER BY id;
 id | has_rownum_1 
----+--------------
  1 | t
  2 | t
  3 | t
(3 rows)

--
-- UNION ALL with ROWNUM
-- In Oracle, each UNION branch has independent ROWNUM counter.
-- The counter resets when switching between UNION branches.
--
-- Basic UNION ALL with ROWNUM
SELECT ROWNUM, id FROM (SELECT 1 AS id FROM DUAL UNION ALL SELECT 2 FROM DUAL UNION ALL SELECT 3 FROM DUAL)
UNION ALL
SELECT ROWNUM, id FROM (SELECT 4 AS id FROM DUAL UNION ALL SELECT 5 FROM DUAL UNION ALL SELECT 6 FROM DUAL);
 rownum | id 
--------+----
      1 |  1
      2 |  2
      3 |  3
      1 |  4
      2 |  5
      3 |  6
(6 rows)

-- UNION ALL with tables
SELECT ROWNUM, id FROM (SELECT id FROM rownum_test WHERE id <= 3 ORDER BY id)
UNION ALL
SELECT ROWNUM, id FROM (SELECT id FROM rownum_test WHERE id BETWEEN 4 AND 6 ORDER BY id);
 rownum | id 
--------+----
      1 |  1
      2 |  2
      3 |  3
      1 |  4
      2 |  5
      3 |  6
(6 rows)

-- Multiple UNION ALL branches
SELECT ROWNUM, 'a' as src FROM (SELECT 1 FROM DUAL UNION ALL SELECT 2 FROM DUAL)
UNION ALL
SELECT ROWNUM, 'b' as src FROM (SELECT 1 FROM DUAL UNION ALL SELECT 2 FROM DUAL)
UNION ALL
SELECT ROWNUM, 'c' as src FROM (SELECT 1 FROM DUAL UNION ALL SELECT 2 FROM DUAL);
 rownum | src 
--------+-----
      1 | a
      2 | a
      1 | b
      2 | b
      1 | c
      2 | c
(6 rows)

--
-- UNION (not UNION ALL) with ROWNUM
-- UNION uses MergeAppend + Unique nodes, so needs different ROWNUM reset handling.
-- Each UNION branch should have independent ROWNUM counting.
--
-- Test 1: Simple UNION with ROWNUM
-- Creates two tables to avoid relying on ordering within branches
CREATE TABLE test1 (id int);
CREATE TABLE test2 (id int);
INSERT INTO test1 VALUES (1), (2), (3);
INSERT INTO test2 VALUES (4), (5), (6);
-- Each branch should have ROWNUM 1,2,3 independently
-- Result is sorted by the UNION's deduplication process
SELECT ROWNUM as rn, id FROM test1
UNION
SELECT ROWNUM as rn, id FROM test2
ORDER BY rn, id;
 rn | id 
----+----
  1 |  1
  1 |  4
  2 |  2
  2 |  5
  3 |  3
  3 |  6
(6 rows)

-- Test 2: UNION with ORDER BY in subqueries
SELECT ROWNUM as rn, id FROM (SELECT id FROM test1 ORDER BY id)
UNION
SELECT ROWNUM as rn, id FROM (SELECT id FROM test2 ORDER BY id)
ORDER BY rn, id;
 rn | id 
----+----
  1 |  1
  1 |  4
  2 |  2
  2 |  5
  3 |  3
  3 |  6
(6 rows)

-- Test 3: Multiple UNION branches
SELECT ROWNUM, 'a' as src FROM (SELECT 1 FROM DUAL UNION ALL SELECT 2 FROM DUAL)
UNION
SELECT ROWNUM, 'b' as src FROM (SELECT 1 FROM DUAL UNION ALL SELECT 2 FROM DUAL)
UNION
SELECT ROWNUM, 'c' as src FROM (SELECT 1 FROM DUAL UNION ALL SELECT 2 FROM DUAL)
ORDER BY src, rownum;
 rownum | src 
--------+-----
      1 | a
      2 | a
      1 | b
      2 | b
      1 | c
      2 | c
(6 rows)

DROP TABLE test1;
DROP TABLE test2;
--
-- INTERSECT and EXCEPT with ROWNUM
-- NOTE: Oracle resets ROWNUM for each side of INTERSECT/EXCEPT independently.
-- Current IvorySQL implementation shares ROWNUM counter across both sides,
-- which produces different results than Oracle.
--
-- INTERSECT with ROWNUM
-- Oracle: Each side produces (1,1), (2,2), (3,3) independently, intersection = 3 rows
-- IvorySQL: Left side produces (1,1), (2,2), (3,3), right side produces (4,1), (5,2), (6,3)
--           No intersection because ROWNUM values differ
SELECT ROWNUM as rn, id FROM (SELECT 1 as id FROM dual UNION ALL SELECT 2 FROM dual UNION ALL SELECT 3 FROM dual)
INTERSECT
SELECT ROWNUM as rn, id FROM (SELECT 1 as id FROM dual UNION ALL SELECT 2 FROM dual UNION ALL SELECT 3 FROM dual)
ORDER BY rn;
 rn | id 
----+----
(0 rows)

-- EXCEPT with ROWNUM
-- Oracle: Left (1,1),(2,2),(3,3) EXCEPT Right (1,2) = (1,1),(2,2),(3,3) (no match on rn)
-- IvorySQL: Left (1,1),(2,2),(3,3) EXCEPT Right (4,2) = (1,1),(2,2),(3,3)
SELECT ROWNUM as rn, id FROM (SELECT 1 as id FROM dual UNION ALL SELECT 2 FROM dual UNION ALL SELECT 3 FROM dual)
EXCEPT
SELECT ROWNUM as rn, id FROM (SELECT 2 as id FROM dual)
ORDER BY rn;
 rn | id 
----+----
  1 |  1
  2 |  2
  3 |  3
(3 rows)

--
-- LATERAL join with ROWNUM
-- NOTE: Oracle resets ROWNUM for each outer row in LATERAL/CROSS APPLY.
-- Current IvorySQL implementation does not reset, counter continues across outer rows.
--
CREATE TABLE lat_test (id int);
INSERT INTO lat_test VALUES (1), (2), (3);
-- LATERAL subquery with ROWNUM
-- Oracle produces: (1,1), (2,1), (2,2), (3,1), (3,2), (3,3) - resets for each outer row
-- IvorySQL produces: (1,1), (2,2), (2,3), (3,4), (3,5), (3,6) - counter continues
SELECT t.id as outer_id, sub.rn
FROM lat_test t,
LATERAL (SELECT ROWNUM as rn FROM lat_test lt WHERE lt.id <= t.id) sub
ORDER BY t.id, sub.rn;
 outer_id | rn 
----------+----
        1 |  1
        2 |  2
        2 |  3
        3 |  4
        3 |  5
        3 |  6
(6 rows)

DROP TABLE lat_test;
--
-- DELETE with ROWNUM
-- Oracle supports DELETE WHERE ROWNUM <= N to delete first N rows
--
CREATE TABLE del_test (id int, val varchar(10));
INSERT INTO del_test VALUES (1, 'a'), (2, 'b'), (3, 'c'), (4, 'd'), (5, 'e');
-- Delete first 2 rows
DELETE FROM del_test WHERE ROWNUM <= 2;
SELECT * FROM del_test ORDER BY id;
 id | val 
----+-----
  3 | c
  4 | d
  5 | e
(3 rows)

DROP TABLE del_test;
--
-- UPDATE with ROWNUM
-- Oracle supports UPDATE ... WHERE ROWNUM <= N to update first N rows
--
CREATE TABLE upd_test (id int, val varchar(10));
INSERT INTO upd_test VALUES (1, 'a'), (2, 'b'), (3, 'c'), (4, 'd'), (5, 'e');
-- Update first 2 rows
UPDATE upd_test SET val = 'updated' WHERE ROWNUM <= 2;
SELECT * FROM upd_test ORDER BY id;
 id |   val   
----+---------
  1 | updated
  2 | updated
  3 | c
  4 | d
  5 | e
(5 rows)

DROP TABLE upd_test;
--
-- ROWNUM with empty table
--
CREATE TABLE empty_test (id int);
-- ROWNUM on empty table should return no rows
SELECT ROWNUM, id FROM empty_test;
 rownum | id 
--------+----
(0 rows)

SELECT COUNT(*) FROM empty_test WHERE ROWNUM <= 5;
 count 
-------
     0
(1 row)

DROP TABLE empty_test;
--
-- ROWNUM pagination with nested subqueries
-- Common Oracle pagination pattern: SELECT FROM (SELECT ... ROWNUM) WHERE rnum >= N
--
CREATE TABLE eemp(
    empno NUMBER(4) NOT NULL CONSTRAINT emp_pk PRIMARY KEY,
    ename VARCHAR2(10),
    sal NUMBER(7,2)
);
INSERT INTO eemp VALUES (7369,'SMITH',800);
INSERT INTO eemp VALUES (7499,'ALLEN',1600);
INSERT INTO eemp VALUES (7521,'WARD',1250);
INSERT INTO eemp VALUES (7566,'JONES',2975);
INSERT INTO eemp VALUES (7654,'MARTIN',1250);
INSERT INTO eemp VALUES (7698,'BLAKE',2850);
INSERT INTO eemp VALUES (7782,'CLARK',2450);
INSERT INTO eemp VALUES (7788,'SCOTT',3000);
INSERT INTO eemp VALUES (7839,'KING',5000);
INSERT INTO eemp VALUES (7844,'TURNER',1500);
INSERT INTO eemp VALUES (7876,'ADAMS',1100);
INSERT INTO eemp VALUES (7900,'JAMES',950);
INSERT INTO eemp VALUES (7902,'FORD',3000);
INSERT INTO eemp VALUES (7934,'MILLER',1300);
-- Pagination query: get rows 8-12 (sorted by sal)
-- This is the standard Oracle pagination pattern
SELECT *
FROM (
    SELECT a.*, rownum rnum
    FROM (
        SELECT empno, sal
        FROM eemp
        ORDER BY sal
    ) a
    WHERE rownum <= 12
)
WHERE rnum >= 8;
 empno |   sal   | rnum 
-------+---------+------
 7499  | 1600.00 |    8
 7782  | 2450.00 |    9
 7698  | 2850.00 |   10
 7566  | 2975.00 |   11
 7902  | 3000.00 |   12
(5 rows)

-- Expected result:
--  empno |   sal   | rnum
-- -------+---------+------
--  7499  | 1600.00 |    8
--  7782  | 2450.00 |    9
--  7698  | 2850.00 |   10
--  7566  | 2975.00 |   11
--  7902  | 3000.00 |   12
-- (5 rows)
-- Verify ROWNUM values are consecutive in inner query
SELECT empno, sal, rownum as rnum
FROM (
    SELECT empno, sal
    FROM eemp
    ORDER BY sal
) a
WHERE rownum <= 12;
 empno |   sal   | rnum 
-------+---------+------
 7369  | 800.00  |    1
 7900  | 950.00  |    2
 7876  | 1100.00 |    3
 7521  | 1250.00 |    4
 7654  | 1250.00 |    5
 7934  | 1300.00 |    6
 7844  | 1500.00 |    7
 7499  | 1600.00 |    8
 7782  | 2450.00 |    9
 7698  | 2850.00 |   10
 7566  | 2975.00 |   11
 7902  | 3000.00 |   12
(12 rows)

DROP TABLE eemp;
--
-- ROWNUM with GROUP BY validation
-- ROWNUM must appear in GROUP BY clause or be used in aggregate function
--
CREATE TABLE grp_test (id int, category varchar(10));
INSERT INTO grp_test VALUES (1, 'A'), (2, 'A'), (3, 'B'), (4, 'B'), (5, 'C');
-- Error: ROWNUM not in GROUP BY and not in aggregate
SELECT rownum FROM grp_test GROUP BY category;
ERROR:  ROWNUM: must appear in the GROUP BY clause or be used in an aggregate function
LINE 1: SELECT rownum FROM grp_test GROUP BY category;
               ^
-- OK: ROWNUM in GROUP BY clause
SELECT rownum FROM grp_test GROUP BY rownum ORDER BY rownum;
 rownum 
--------
      1
      2
      3
      4
      5
(5 rows)

DROP TABLE grp_test;
--
-- ROWNUM with aggregate functions
-- Aggregate functions should evaluate ROWNUM for each row during scan
--
CREATE TABLE agg_test (id int, val int);
INSERT INTO agg_test VALUES (1, 10), (2, 20), (3, 30), (4, 40), (5, 50), (6, 60);
-- MIN/MAX/SUM/AVG with ROWNUM
-- For 6 rows: MIN=1, MAX=6, SUM=21, AVG=3.5
SELECT MIN(rownum), MAX(rownum), SUM(rownum), AVG(rownum) FROM agg_test;
 min | max | sum |        avg         
-----+-----+-----+--------------------
   1 |   6 |  21 | 3.5000000000000000
(1 row)

-- COUNT with ROWNUM
SELECT COUNT(*), COUNT(rownum) FROM agg_test;
 count | count 
-------+-------
     6 |     6
(1 row)

-- Aggregate with ROWNUM expression
SELECT SUM(rownum * 2), SUM(rownum) * 2 FROM agg_test;
 sum | ?column? 
-----+----------
  42 |       42
(1 row)

-- Aggregate with ROWNUM and GROUP BY
SELECT val / 20 as grp, MIN(rownum), MAX(rownum)
FROM agg_test
GROUP BY val / 20
ORDER BY grp;
 grp | min | max 
-----+-----+-----
   0 |   1 |   1
   1 |   2 |   3
   2 |   4 |   5
   3 |   6 |   6
(4 rows)

DROP TABLE agg_test;
--
-- ROWNUM with nested aggregate functions
-- Test that ROWNUM works correctly in nested subqueries with aggregates
--
CREATE TABLE agg_nest_test (id int, val int);
INSERT INTO agg_nest_test VALUES (1, 10), (2, 20), (3, 30), (4, 40), (5, 50), (6, 60);
-- Subquery with aggregate containing ROWNUM
SELECT * FROM (
    SELECT MIN(rownum) as min_rn, MAX(rownum) as max_rn, SUM(rownum) as sum_rn
    FROM agg_nest_test
) sub;
 min_rn | max_rn | sum_rn 
--------+--------+--------
      1 |      6 |     21
(1 row)

-- Aggregate of subquery with ROWNUM
SELECT SUM(rn) FROM (SELECT rownum as rn FROM agg_nest_test) sub;
 sum 
-----
  21
(1 row)

-- Nested subquery aggregates (use float division for Oracle compatibility)
SELECT MAX(sum_rn) FROM (
    SELECT val/20.0 as grp, SUM(rownum) as sum_rn
    FROM agg_nest_test
    GROUP BY val/20.0
) sub;
 max 
-----
   6
(1 row)

-- Multiple levels of aggregation
SELECT AVG(max_rn) FROM (
    SELECT val/30.0 as grp, MAX(rownum) as max_rn
    FROM agg_nest_test
    GROUP BY val/30.0
) sub;
        avg         
--------------------
 3.5000000000000000
(1 row)

DROP TABLE agg_nest_test;
--
-- ROWNUM with aggregate functions + GROUP BY + ORDER BY
-- Test that aggregate column order doesn't affect query execution
-- Bug: "Aggref found in non-Agg plan node" when ROWNUM aggregate wasn't last
--
CREATE TABLE agg_order_test (a int, b int);
INSERT INTO agg_order_test VALUES (1, 10), (1, 20), (2, 30), (2, 40), (3, 50);
-- Test 1: SUM(rownum) first, then COUNT(*) with ORDER BY
-- For a=1: rows 1,2 → sum=3, count=2
-- For a=2: rows 3,4 → sum=7, count=2
-- For a=3: row 5 → sum=5, count=1
SELECT a, SUM(rownum), COUNT(*) FROM agg_order_test GROUP BY a ORDER BY a;
 a | sum | count 
---+-----+-------
 1 |   3 |     2
 2 |   7 |     2
 3 |   5 |     1
(3 rows)

-- Test 2: COUNT(*) first, then SUM(rownum) with ORDER BY (different column order)
SELECT a, COUNT(*), SUM(rownum) FROM agg_order_test GROUP BY a ORDER BY a;
 a | count | sum 
---+-------+-----
 1 |     2 |   3
 2 |     2 |   7
 3 |     1 |   5
(3 rows)

-- Test 3: Multiple aggregates with ROWNUM in various positions
SELECT a, MIN(rownum), MAX(rownum), AVG(rownum), SUM(rownum), COUNT(*)
FROM agg_order_test GROUP BY a ORDER BY a;
 a | min | max |        avg         | sum | count 
---+-----+-----+--------------------+-----+-------
 1 |   1 |   2 | 1.5000000000000000 |   3 |     2
 2 |   3 |   4 | 3.5000000000000000 |   7 |     2
 3 |   5 |   5 | 5.0000000000000000 |   5 |     1
(3 rows)

-- Test 4: ORDER BY aggregate result
SELECT a, SUM(rownum) as s FROM agg_order_test GROUP BY a ORDER BY s;
 a | s 
---+---
 1 | 3
 3 | 5
 2 | 7
(3 rows)

-- Test 5: ORDER BY DESC
SELECT a, SUM(rownum), COUNT(*) FROM agg_order_test GROUP BY a ORDER BY a DESC;
 a | sum | count 
---+-----+-------
 3 |   5 |     1
 2 |   7 |     2
 1 |   3 |     2
(3 rows)

DROP TABLE agg_order_test;
--
-- Multi-layer nested aggregation with ROWNUM + GROUP BY + ORDER BY
-- Test multiple levels of aggregation where ROWNUM is used at the innermost level
--
CREATE TABLE multi_agg_test (a int, b int, c int);
INSERT INTO multi_agg_test VALUES
    (1, 1, 10), (1, 1, 20), (1, 2, 30),
    (2, 1, 40), (2, 2, 50), (2, 2, 60);
-- Test 1: Two layers of aggregation
-- Inner: aggregate ROWNUM by (a, b)
-- Outer: aggregate by (a) with ORDER BY
SELECT a, SUM(inner_sum) as total_sum, COUNT(*) as group_count
FROM (
    SELECT a, b, SUM(rownum) as inner_sum, COUNT(*) as inner_count
    FROM multi_agg_test
    GROUP BY a, b
    ORDER BY a, b
) sub
GROUP BY a
ORDER BY a;
 a | total_sum | group_count 
---+-----------+-------------
 1 |         6 |           2
 2 |        15 |           2
(2 rows)

-- Test 2: Three layers of aggregation
SELECT MAX(mid_sum) as max_mid_sum
FROM (
    SELECT a, SUM(inner_sum) as mid_sum
    FROM (
        SELECT a, b, SUM(rownum) as inner_sum
        FROM multi_agg_test
        GROUP BY a, b
        ORDER BY a, b
    ) layer1
    GROUP BY a
    ORDER BY a
) layer2;
 max_mid_sum 
-------------
          15
(1 row)

-- Test 3: Different aggregate functions at each layer with ORDER BY
SELECT a, AVG(inner_max), SUM(inner_min), COUNT(*)
FROM (
    SELECT a, b, MAX(rownum) as inner_max, MIN(rownum) as inner_min
    FROM multi_agg_test
    GROUP BY a, b
    ORDER BY a, b
) sub
GROUP BY a
ORDER BY a;
 a |        avg         | sum | count 
---+--------------------+-----+-------
 1 | 2.5000000000000000 |   4 |     2
 2 | 5.0000000000000000 |   9 |     2
(2 rows)

-- Test 4: Nested aggregation with ROWNUM in arithmetic expression
SELECT a, SUM(rownum_doubled) as total_doubled
FROM (
    SELECT a, b, SUM(rownum * 2) as rownum_doubled
    FROM multi_agg_test
    GROUP BY a, b
    ORDER BY a
) sub
GROUP BY a
ORDER BY a DESC;
 a | total_doubled 
---+---------------
 2 |            30
 1 |            12
(2 rows)

DROP TABLE multi_agg_test;
--
-- SCROLL CURSOR with ROWNUM
-- Bug: FETCH PRIOR/NEXT re-evaluates ROWNUM instead of using materialized values
-- https://github.com/IvorySQL/IvorySQL/pull/1000#issuecomment-3717658753
--
CREATE TABLE cursor_rownum_test (c1 serial, c2 int);
INSERT INTO cursor_rownum_test (c2) SELECT generate_series(1, 20);
-- Test scroll cursor with ROWNUM in subquery
BEGIN;
-- Declare a scroll cursor with ROWNUM in subquery
DECLARE cursor_rn SCROLL CURSOR FOR
SELECT *
FROM (SELECT *, rownum rn FROM cursor_rownum_test WHERE rownum <= 10) AS foo
WHERE rn > 3 LIMIT 5;
-- Fetch all rows - should get rows with rn 4,5,6,7,8
FETCH ALL IN cursor_rn;
 c1 | c2 | rn 
----+----+----
  4 |  4 |  4
  5 |  5 |  5
  6 |  6 |  6
  7 |  7 |  7
  8 |  8 |  8
(5 rows)

-- FETCH FIRST should return row with rn=4
FETCH FIRST IN cursor_rn;
 c1 | c2 | rn 
----+----+----
  4 |  4 |  4
(1 row)

-- FETCH LAST should return row with rn=8
FETCH LAST IN cursor_rn;
 c1 | c2 | rn 
----+----+----
  8 |  8 |  8
(1 row)

-- FETCH PRIOR from LAST should return row with rn=7 (not a new incremented value)
FETCH PRIOR IN cursor_rn;
 c1 | c2 | rn 
----+----+----
  7 |  7 |  7
(1 row)

-- FETCH NEXT should return row with rn=8 again (not a new incremented value)
FETCH NEXT IN cursor_rn;
 c1 | c2 | rn 
----+----+----
  8 |  8 |  8
(1 row)

-- FETCH ABSOLUTE 2 should return row with rn=5
FETCH ABSOLUTE 2 IN cursor_rn;
 c1 | c2 | rn 
----+----+----
  5 |  5 |  5
(1 row)

-- FETCH RELATIVE -1 should return row with rn=4
FETCH RELATIVE -1 IN cursor_rn;
 c1 | c2 | rn 
----+----+----
  4 |  4 |  4
(1 row)

CLOSE cursor_rn;
COMMIT;
-- Test scroll cursor with deeply nested ROWNUM (multiple levels)
BEGIN;
DECLARE cursor_nested SCROLL CURSOR FOR
SELECT * FROM (
    SELECT rownum as outer_rn, * FROM (
        SELECT rownum as inner_rn, c1, c2
        FROM cursor_rownum_test
        WHERE rownum <= 8
    ) sub1
    WHERE rownum <= 6
) sub2
WHERE outer_rn <= 4;
-- Fetch all rows
FETCH ALL IN cursor_nested;
 outer_rn | inner_rn | c1 | c2 
----------+----------+----+----
        1 |        1 |  1 |  1
        2 |        2 |  2 |  2
        3 |        3 |  3 |  3
        4 |        4 |  4 |  4
(4 rows)

-- FETCH LAST
FETCH LAST IN cursor_nested;
 outer_rn | inner_rn | c1 | c2 
----------+----------+----+----
        4 |        4 |  4 |  4
(1 row)

-- FETCH PRIOR - should preserve both outer_rn and inner_rn values
FETCH PRIOR IN cursor_nested;
 outer_rn | inner_rn | c1 | c2 
----------+----------+----+----
        3 |        3 |  3 |  3
(1 row)

-- FETCH FIRST
FETCH FIRST IN cursor_nested;
 outer_rn | inner_rn | c1 | c2 
----------+----------+----+----
        1 |        1 |  1 |  1
(1 row)

-- FETCH NEXT - should preserve both outer_rn and inner_rn values
FETCH NEXT IN cursor_nested;
 outer_rn | inner_rn | c1 | c2 
----------+----------+----+----
        2 |        2 |  2 |  2
(1 row)

CLOSE cursor_nested;
COMMIT;
DROP TABLE cursor_rownum_test;
--
-- ROWNUM as column/table alias
-- Oracle does NOT allow ROWNUM as column alias (with or without AS) or table alias.
-- https://github.com/IvorySQL/IvorySQL/pull/1000#issuecomment-3717690863
--
-- Current IvorySQL behavior: Allows ROWNUM as alias (differs from Oracle)
-- TODO: These should produce errors to match Oracle behavior
--
CREATE TABLE alias_test (id int, name varchar(10), job varchar(10));
INSERT INTO alias_test VALUES (1, 'SMITH', 'CLERK'), (2, 'ALLEN', 'SALESMAN');
-- Test 1: ROWNUM as column alias without AS
-- Oracle: ERROR ORA-00923: FROM keyword not found where expected
-- IvorySQL: Currently allows this (incorrectly treats 'rownum' as alias for 'job')
SELECT id, name, job rownum FROM alias_test;
 id | name  |  rownum  
----+-------+----------
  1 | SMITH | CLERK
  2 | ALLEN | SALESMAN
(2 rows)

-- Test 2: ROWNUM as column alias with AS
-- Oracle: ERROR ORA-00923: FROM keyword not found where expected
-- IvorySQL: Currently allows this
SELECT id, name, job AS rownum FROM alias_test;
 id | name  |  rownum  
----+-------+----------
  1 | SMITH | CLERK
  2 | ALLEN | SALESMAN
(2 rows)

-- Test 3: ROWNUM as table alias
-- Oracle: ERROR ORA-00923: FROM keyword not found where expected
-- IvorySQL: Currently allows this
SELECT rownum.id FROM alias_test rownum;
 id 
----
  1
  2
(2 rows)

DROP TABLE alias_test;
--
-- Cleanup
--
DROP TABLE rownum_test CASCADE;
DROP TABLE dept CASCADE;
