-- predictability
SET synchronous_commit = on;
DROP TABLE IF EXISTS xpto;
NOTICE:  table "xpto" does not exist, skipping
SELECT 'init' FROM pg_create_logical_replication_slot('regression_slot', 'test_decoding');
 ?column? 
----------
 init
(1 row)

CREATE SEQUENCE xpto_rand_seq START WITH 79 INCREMENT BY 1499; -- portable "random"
CREATE TABLE xpto (
    id serial primary key,
    toasted_col1 text,
    rand1 float8 DEFAULT nextval('xpto_rand_seq'),
    toasted_col2 text,
    rand2 float8 DEFAULT nextval('xpto_rand_seq')
);
-- uncompressed external toast data
INSERT INTO xpto (toasted_col1, toasted_col2) SELECT string_agg(g.i::text, ''), string_agg((g.i*2)::text, '') FROM generate_series(1, 2000) g(i);
-- compressed external toast data
INSERT INTO xpto (toasted_col2) SELECT repeat(string_agg(to_char(g.i, 'FM0000'), ''), 50) FROM generate_series(1, 500) g(i);
-- update of existing column
UPDATE xpto SET toasted_col1 = (SELECT string_agg(g.i::text, '') FROM generate_series(1, 2000) g(i)) WHERE id = 1;
UPDATE xpto SET rand1 = 123.456 WHERE id = 1;
-- updating external via INSERT ... ON CONFLICT DO UPDATE
INSERT INTO xpto(id, toasted_col2) VALUES (2, 'toasted2-upsert')
ON CONFLICT (id)
DO UPDATE SET toasted_col2 = EXCLUDED.toasted_col2 || xpto.toasted_col2;
DELETE FROM xpto WHERE id = 1;
DROP TABLE IF EXISTS toasted_key;
NOTICE:  table "toasted_key" does not exist, skipping
CREATE TABLE toasted_key (
    id serial,
    toasted_key text PRIMARY KEY,
    toasted_col1 text,
    toasted_col2 text
);
ALTER TABLE toasted_key ALTER COLUMN toasted_key SET STORAGE EXTERNAL;
ALTER TABLE toasted_key ALTER COLUMN toasted_col1 SET STORAGE EXTERNAL;
INSERT INTO toasted_key(toasted_key, toasted_col1) VALUES(repeat('1234567890', 200), repeat('9876543210', 200));
-- test update of a toasted key without changing it
UPDATE toasted_key SET toasted_col2 = toasted_col1;
-- test update of a toasted key, changing it
UPDATE toasted_key SET toasted_key = toasted_key || '1';
DELETE FROM toasted_key;
-- Test that HEAP2_MULTI_INSERT insertions with and without toasted
-- columns are handled correctly
CREATE TABLE toasted_copy (
    id int primary key, -- no default, copy didn't use to handle that with multi inserts
    data text
);
ALTER TABLE toasted_copy ALTER COLUMN data SET STORAGE EXTERNAL;
\copy toasted_copy FROM STDIN
SELECT substr(data, 1, 200) FROM pg_logical_slot_get_changes('regression_slot', NULL, NULL, 'include-xids', '0', 'skip-empty-xacts', '1');
                                                                                                  substr                                                                                                  
----------------------------------------------------------------------------------------------------------------------------------------------------------------------------------------------------------
 BEGIN
 table public.xpto: INSERT: id[pg_catalog.int4]:1 toasted_col1[text]:'12345678910111213141516171819202122232425262728293031323334353637383940414243444546474849505152535455565758596061626364656667686970
 COMMIT
 BEGIN
 table public.xpto: INSERT: id[pg_catalog.int4]:2 toasted_col1[text]:null rand1[pg_catalog.float8]:3077 toasted_col2[text]:'00010002000300040005000600070008000900100011001200130014001500160017001800190
 COMMIT
 BEGIN
 table public.xpto: UPDATE: id[pg_catalog.int4]:1 toasted_col1[text]:'12345678910111213141516171819202122232425262728293031323334353637383940414243444546474849505152535455565758596061626364656667686970
 COMMIT
 BEGIN
 table public.xpto: UPDATE: id[pg_catalog.int4]:1 toasted_col1[text]:unchanged-toast-datum rand1[pg_catalog.float8]:123.456 toasted_col2[text]:unchanged-toast-datum rand2[pg_catalog.float8]:1578
 COMMIT
 BEGIN
 table public.xpto: UPDATE: id[pg_catalog.int4]:2 toasted_col1[text]:null rand1[pg_catalog.float8]:3077 toasted_col2[text]:'toasted2-upsert00010002000300040005000600070008000900100011001200130014001500
 COMMIT
 BEGIN
 table public.xpto: DELETE: id[pg_catalog.int4]:1
 COMMIT
 BEGIN
 table public.toasted_key: INSERT: id[pg_catalog.int4]:1 toasted_key[text]:'12345678901234567890123456789012345678901234567890123456789012345678901234567890123456789012345678901234567890123456789012345
 COMMIT
 BEGIN
 table public.toasted_key: UPDATE: old-key: toasted_key[text]:'123456789012345678901234567890123456789012345678901234567890123456789012345678901234567890123456789012345678901234567890123456789012345678
 COMMIT
 BEGIN
 table public.toasted_key: UPDATE: old-key: toasted_key[text]:'123456789012345678901234567890123456789012345678901234567890123456789012345678901234567890123456789012345678901234567890123456789012345678
 COMMIT
 BEGIN
 table public.toasted_key: DELETE: toasted_key[text]:'123456789012345678901234567890123456789012345678901234567890123456789012345678901234567890123456789012345678901234567890123456789012345678901234567
 COMMIT
 BEGIN
 table public.toasted_copy: INSERT: id[pg_catalog.int4]:1 data[text]:'untoasted1'
 table public.toasted_copy: INSERT: id[pg_catalog.int4]:2 data[text]:'toasted1-12345678901234567890123456789012345678901234567890123456789012345678901234567890123456789012345678901234567890123456789012
 table public.toasted_copy: INSERT: id[pg_catalog.int4]:3 data[text]:'untoasted2'
 table public.toasted_copy: INSERT: id[pg_catalog.int4]:4 data[text]:'toasted2-12345678901234567890123456789012345678901234567890123456789012345678901234567890123456789012345678901234567890123456789012
 table public.toasted_copy: INSERT: id[pg_catalog.int4]:5 data[text]:'untoasted3'
 table public.toasted_copy: INSERT: id[pg_catalog.int4]:6 data[text]:'untoasted4'
 table public.toasted_copy: INSERT: id[pg_catalog.int4]:7 data[text]:'untoasted5'
 table public.toasted_copy: INSERT: id[pg_catalog.int4]:8 data[text]:'untoasted6'
 table public.toasted_copy: INSERT: id[pg_catalog.int4]:9 data[text]:'untoasted7'
 table public.toasted_copy: INSERT: id[pg_catalog.int4]:10 data[text]:'untoasted8'
 table public.toasted_copy: INSERT: id[pg_catalog.int4]:11 data[text]:'untoasted9'
 table public.toasted_copy: INSERT: id[pg_catalog.int4]:12 data[text]:'untoasted10'
 table public.toasted_copy: INSERT: id[pg_catalog.int4]:13 data[text]:'untoasted11'
 table public.toasted_copy: INSERT: id[pg_catalog.int4]:14 data[text]:'untoasted12'
 table public.toasted_copy: INSERT: id[pg_catalog.int4]:15 data[text]:'untoasted13'
 table public.toasted_copy: INSERT: id[pg_catalog.int4]:16 data[text]:'untoasted14'
 table public.toasted_copy: INSERT: id[pg_catalog.int4]:17 data[text]:'untoasted15'
 table public.toasted_copy: INSERT: id[pg_catalog.int4]:18 data[text]:'untoasted16'
 table public.toasted_copy: INSERT: id[pg_catalog.int4]:19 data[text]:'untoasted17'
 table public.toasted_copy: INSERT: id[pg_catalog.int4]:20 data[text]:'untoasted18'
 table public.toasted_copy: INSERT: id[pg_catalog.int4]:21 data[text]:'untoasted19'
 table public.toasted_copy: INSERT: id[pg_catalog.int4]:22 data[text]:'untoasted20'
 table public.toasted_copy: INSERT: id[pg_catalog.int4]:23 data[text]:'untoasted21'
 table public.toasted_copy: INSERT: id[pg_catalog.int4]:24 data[text]:'untoasted22'
 table public.toasted_copy: INSERT: id[pg_catalog.int4]:25 data[text]:'untoasted23'
 table public.toasted_copy: INSERT: id[pg_catalog.int4]:26 data[text]:'untoasted24'
 table public.toasted_copy: INSERT: id[pg_catalog.int4]:27 data[text]:'untoasted25'
 table public.toasted_copy: INSERT: id[pg_catalog.int4]:28 data[text]:'untoasted26'
 table public.toasted_copy: INSERT: id[pg_catalog.int4]:29 data[text]:'untoasted27'
 table public.toasted_copy: INSERT: id[pg_catalog.int4]:30 data[text]:'untoasted28'
 table public.toasted_copy: INSERT: id[pg_catalog.int4]:31 data[text]:'untoasted29'
 table public.toasted_copy: INSERT: id[pg_catalog.int4]:32 data[text]:'untoasted30'
 table public.toasted_copy: INSERT: id[pg_catalog.int4]:33 data[text]:'untoasted31'
 table public.toasted_copy: INSERT: id[pg_catalog.int4]:34 data[text]:'untoasted32'
 table public.toasted_copy: INSERT: id[pg_catalog.int4]:35 data[text]:'untoasted33'
 table public.toasted_copy: INSERT: id[pg_catalog.int4]:36 data[text]:'untoasted34'
 table public.toasted_copy: INSERT: id[pg_catalog.int4]:37 data[text]:'untoasted35'
 table public.toasted_copy: INSERT: id[pg_catalog.int4]:38 data[text]:'untoasted36'
 table public.toasted_copy: INSERT: id[pg_catalog.int4]:39 data[text]:'untoasted37'
 table public.toasted_copy: INSERT: id[pg_catalog.int4]:40 data[text]:'untoasted38'
 table public.toasted_copy: INSERT: id[pg_catalog.int4]:41 data[text]:'untoasted39'
 table public.toasted_copy: INSERT: id[pg_catalog.int4]:42 data[text]:'untoasted40'
 table public.toasted_copy: INSERT: id[pg_catalog.int4]:43 data[text]:'untoasted41'
 table public.toasted_copy: INSERT: id[pg_catalog.int4]:44 data[text]:'untoasted42'
 table public.toasted_copy: INSERT: id[pg_catalog.int4]:45 data[text]:'untoasted43'
 table public.toasted_copy: INSERT: id[pg_catalog.int4]:46 data[text]:'untoasted44'
 table public.toasted_copy: INSERT: id[pg_catalog.int4]:47 data[text]:'untoasted45'
 table public.toasted_copy: INSERT: id[pg_catalog.int4]:48 data[text]:'untoasted46'
 table public.toasted_copy: INSERT: id[pg_catalog.int4]:49 data[text]:'untoasted47'
 table public.toasted_copy: INSERT: id[pg_catalog.int4]:50 data[text]:'untoasted48'
 table public.toasted_copy: INSERT: id[pg_catalog.int4]:51 data[text]:'untoasted49'
 table public.toasted_copy: INSERT: id[pg_catalog.int4]:52 data[text]:'untoasted50'
 table public.toasted_copy: INSERT: id[pg_catalog.int4]:53 data[text]:'untoasted51'
 table public.toasted_copy: INSERT: id[pg_catalog.int4]:54 data[text]:'untoasted52'
 table public.toasted_copy: INSERT: id[pg_catalog.int4]:55 data[text]:'untoasted53'
 table public.toasted_copy: INSERT: id[pg_catalog.int4]:56 data[text]:'untoasted54'
 table public.toasted_copy: INSERT: id[pg_catalog.int4]:57 data[text]:'untoasted55'
 table public.toasted_copy: INSERT: id[pg_catalog.int4]:58 data[text]:'untoasted56'
 table public.toasted_copy: INSERT: id[pg_catalog.int4]:59 data[text]:'untoasted57'
 table public.toasted_copy: INSERT: id[pg_catalog.int4]:60 data[text]:'untoasted58'
 table public.toasted_copy: INSERT: id[pg_catalog.int4]:61 data[text]:'untoasted59'
 table public.toasted_copy: INSERT: id[pg_catalog.int4]:62 data[text]:'untoasted60'
 table public.toasted_copy: INSERT: id[pg_catalog.int4]:63 data[text]:'untoasted61'
 table public.toasted_copy: INSERT: id[pg_catalog.int4]:64 data[text]:'untoasted62'
 table public.toasted_copy: INSERT: id[pg_catalog.int4]:65 data[text]:'untoasted63'
 table public.toasted_copy: INSERT: id[pg_catalog.int4]:66 data[text]:'untoasted64'
 table public.toasted_copy: INSERT: id[pg_catalog.int4]:67 data[text]:'untoasted65'
 table public.toasted_copy: INSERT: id[pg_catalog.int4]:68 data[text]:'untoasted66'
 table public.toasted_copy: INSERT: id[pg_catalog.int4]:69 data[text]:'untoasted67'
 table public.toasted_copy: INSERT: id[pg_catalog.int4]:70 data[text]:'untoasted68'
 table public.toasted_copy: INSERT: id[pg_catalog.int4]:71 data[text]:'untoasted69'
 table public.toasted_copy: INSERT: id[pg_catalog.int4]:72 data[text]:'untoasted70'
 table public.toasted_copy: INSERT: id[pg_catalog.int4]:73 data[text]:'untoasted71'
 table public.toasted_copy: INSERT: id[pg_catalog.int4]:74 data[text]:'untoasted72'
 table public.toasted_copy: INSERT: id[pg_catalog.int4]:75 data[text]:'untoasted73'
 table public.toasted_copy: INSERT: id[pg_catalog.int4]:76 data[text]:'untoasted74'
 table public.toasted_copy: INSERT: id[pg_catalog.int4]:77 data[text]:'untoasted75'
 table public.toasted_copy: INSERT: id[pg_catalog.int4]:78 data[text]:'untoasted76'
 table public.toasted_copy: INSERT: id[pg_catalog.int4]:79 data[text]:'untoasted77'
 table public.toasted_copy: INSERT: id[pg_catalog.int4]:80 data[text]:'untoasted78'
 table public.toasted_copy: INSERT: id[pg_catalog.int4]:81 data[text]:'untoasted79'
 table public.toasted_copy: INSERT: id[pg_catalog.int4]:82 data[text]:'untoasted80'
 table public.toasted_copy: INSERT: id[pg_catalog.int4]:83 data[text]:'untoasted81'
 table public.toasted_copy: INSERT: id[pg_catalog.int4]:84 data[text]:'untoasted82'
 table public.toasted_copy: INSERT: id[pg_catalog.int4]:85 data[text]:'untoasted83'
 table public.toasted_copy: INSERT: id[pg_catalog.int4]:86 data[text]:'untoasted84'
 table public.toasted_copy: INSERT: id[pg_catalog.int4]:87 data[text]:'untoasted85'
 table public.toasted_copy: INSERT: id[pg_catalog.int4]:88 data[text]:'untoasted86'
 table public.toasted_copy: INSERT: id[pg_catalog.int4]:89 data[text]:'untoasted87'
 table public.toasted_copy: INSERT: id[pg_catalog.int4]:90 data[text]:'untoasted88'
 table public.toasted_copy: INSERT: id[pg_catalog.int4]:91 data[text]:'untoasted89'
 table public.toasted_copy: INSERT: id[pg_catalog.int4]:92 data[text]:'untoasted90'
 table public.toasted_copy: INSERT: id[pg_catalog.int4]:93 data[text]:'untoasted91'
 table public.toasted_copy: INSERT: id[pg_catalog.int4]:94 data[text]:'untoasted92'
 table public.toasted_copy: INSERT: id[pg_catalog.int4]:95 data[text]:'untoasted93'
 table public.toasted_copy: INSERT: id[pg_catalog.int4]:96 data[text]:'untoasted94'
 table public.toasted_copy: INSERT: id[pg_catalog.int4]:97 data[text]:'untoasted95'
 table public.toasted_copy: INSERT: id[pg_catalog.int4]:98 data[text]:'untoasted96'
 table public.toasted_copy: INSERT: id[pg_catalog.int4]:99 data[text]:'untoasted97'
 table public.toasted_copy: INSERT: id[pg_catalog.int4]:100 data[text]:'untoasted98'
 table public.toasted_copy: INSERT: id[pg_catalog.int4]:101 data[text]:'untoasted99'
 table public.toasted_copy: INSERT: id[pg_catalog.int4]:102 data[text]:'untoasted100'
 table public.toasted_copy: INSERT: id[pg_catalog.int4]:103 data[text]:'untoasted101'
 table public.toasted_copy: INSERT: id[pg_catalog.int4]:104 data[text]:'untoasted102'
 table public.toasted_copy: INSERT: id[pg_catalog.int4]:105 data[text]:'untoasted103'
 table public.toasted_copy: INSERT: id[pg_catalog.int4]:106 data[text]:'untoasted104'
 table public.toasted_copy: INSERT: id[pg_catalog.int4]:107 data[text]:'untoasted105'
 table public.toasted_copy: INSERT: id[pg_catalog.int4]:108 data[text]:'untoasted106'
 table public.toasted_copy: INSERT: id[pg_catalog.int4]:109 data[text]:'untoasted107'
 table public.toasted_copy: INSERT: id[pg_catalog.int4]:110 data[text]:'untoasted108'
 table public.toasted_copy: INSERT: id[pg_catalog.int4]:111 data[text]:'untoasted109'
 table public.toasted_copy: INSERT: id[pg_catalog.int4]:112 data[text]:'untoasted110'
 table public.toasted_copy: INSERT: id[pg_catalog.int4]:113 data[text]:'untoasted111'
 table public.toasted_copy: INSERT: id[pg_catalog.int4]:114 data[text]:'untoasted112'
 table public.toasted_copy: INSERT: id[pg_catalog.int4]:115 data[text]:'untoasted113'
 table public.toasted_copy: INSERT: id[pg_catalog.int4]:116 data[text]:'untoasted114'
 table public.toasted_copy: INSERT: id[pg_catalog.int4]:117 data[text]:'untoasted115'
 table public.toasted_copy: INSERT: id[pg_catalog.int4]:118 data[text]:'untoasted116'
 table public.toasted_copy: INSERT: id[pg_catalog.int4]:119 data[text]:'untoasted117'
 table public.toasted_copy: INSERT: id[pg_catalog.int4]:120 data[text]:'untoasted118'
 table public.toasted_copy: INSERT: id[pg_catalog.int4]:121 data[text]:'untoasted119'
 table public.toasted_copy: INSERT: id[pg_catalog.int4]:122 data[text]:'untoasted120'
 table public.toasted_copy: INSERT: id[pg_catalog.int4]:123 data[text]:'untoasted121'
 table public.toasted_copy: INSERT: id[pg_catalog.int4]:124 data[text]:'untoasted122'
 table public.toasted_copy: INSERT: id[pg_catalog.int4]:125 data[text]:'untoasted123'
 table public.toasted_copy: INSERT: id[pg_catalog.int4]:126 data[text]:'untoasted124'
 table public.toasted_copy: INSERT: id[pg_catalog.int4]:127 data[text]:'untoasted125'
 table public.toasted_copy: INSERT: id[pg_catalog.int4]:128 data[text]:'untoasted126'
 table public.toasted_copy: INSERT: id[pg_catalog.int4]:129 data[text]:'untoasted127'
 table public.toasted_copy: INSERT: id[pg_catalog.int4]:130 data[text]:'untoasted128'
 table public.toasted_copy: INSERT: id[pg_catalog.int4]:131 data[text]:'untoasted129'
 table public.toasted_copy: INSERT: id[pg_catalog.int4]:132 data[text]:'untoasted130'
 table public.toasted_copy: INSERT: id[pg_catalog.int4]:133 data[text]:'untoasted131'
 table public.toasted_copy: INSERT: id[pg_catalog.int4]:134 data[text]:'untoasted132'
 table public.toasted_copy: INSERT: id[pg_catalog.int4]:135 data[text]:'untoasted133'
 table public.toasted_copy: INSERT: id[pg_catalog.int4]:136 data[text]:'untoasted134'
 table public.toasted_copy: INSERT: id[pg_catalog.int4]:137 data[text]:'untoasted135'
 table public.toasted_copy: INSERT: id[pg_catalog.int4]:138 data[text]:'untoasted136'
 table public.toasted_copy: INSERT: id[pg_catalog.int4]:139 data[text]:'untoasted137'
 table public.toasted_copy: INSERT: id[pg_catalog.int4]:140 data[text]:'untoasted138'
 table public.toasted_copy: INSERT: id[pg_catalog.int4]:141 data[text]:'untoasted139'
 table public.toasted_copy: INSERT: id[pg_catalog.int4]:142 data[text]:'untoasted140'
 table public.toasted_copy: INSERT: id[pg_catalog.int4]:143 data[text]:'untoasted141'
 table public.toasted_copy: INSERT: id[pg_catalog.int4]:144 data[text]:'untoasted142'
 table public.toasted_copy: INSERT: id[pg_catalog.int4]:145 data[text]:'untoasted143'
 table public.toasted_copy: INSERT: id[pg_catalog.int4]:146 data[text]:'untoasted144'
 table public.toasted_copy: INSERT: id[pg_catalog.int4]:147 data[text]:'untoasted145'
 table public.toasted_copy: INSERT: id[pg_catalog.int4]:148 data[text]:'untoasted146'
 table public.toasted_copy: INSERT: id[pg_catalog.int4]:149 data[text]:'untoasted147'
 table public.toasted_copy: INSERT: id[pg_catalog.int4]:150 data[text]:'untoasted148'
 table public.toasted_copy: INSERT: id[pg_catalog.int4]:151 data[text]:'untoasted149'
 table public.toasted_copy: INSERT: id[pg_catalog.int4]:152 data[text]:'untoasted150'
 table public.toasted_copy: INSERT: id[pg_catalog.int4]:153 data[text]:'untoasted151'
 table public.toasted_copy: INSERT: id[pg_catalog.int4]:154 data[text]:'untoasted152'
 table public.toasted_copy: INSERT: id[pg_catalog.int4]:155 data[text]:'untoasted153'
 table public.toasted_copy: INSERT: id[pg_catalog.int4]:156 data[text]:'untoasted154'
 table public.toasted_copy: INSERT: id[pg_catalog.int4]:157 data[text]:'untoasted155'
 table public.toasted_copy: INSERT: id[pg_catalog.int4]:158 data[text]:'untoasted156'
 table public.toasted_copy: INSERT: id[pg_catalog.int4]:159 data[text]:'untoasted157'
 table public.toasted_copy: INSERT: id[pg_catalog.int4]:160 data[text]:'untoasted158'
 table public.toasted_copy: INSERT: id[pg_catalog.int4]:161 data[text]:'untoasted159'
 table public.toasted_copy: INSERT: id[pg_catalog.int4]:162 data[text]:'untoasted160'
 table public.toasted_copy: INSERT: id[pg_catalog.int4]:163 data[text]:'untoasted161'
 table public.toasted_copy: INSERT: id[pg_catalog.int4]:164 data[text]:'untoasted162'
 table public.toasted_copy: INSERT: id[pg_catalog.int4]:165 data[text]:'untoasted163'
 table public.toasted_copy: INSERT: id[pg_catalog.int4]:166 data[text]:'untoasted164'
 table public.toasted_copy: INSERT: id[pg_catalog.int4]:167 data[text]:'untoasted165'
 table public.toasted_copy: INSERT: id[pg_catalog.int4]:168 data[text]:'untoasted166'
 table public.toasted_copy: INSERT: id[pg_catalog.int4]:169 data[text]:'untoasted167'
 table public.toasted_copy: INSERT: id[pg_catalog.int4]:170 data[text]:'untoasted168'
 table public.toasted_copy: INSERT: id[pg_catalog.int4]:171 data[text]:'untoasted169'
 table public.toasted_copy: INSERT: id[pg_catalog.int4]:172 data[text]:'untoasted170'
 table public.toasted_copy: INSERT: id[pg_catalog.int4]:173 data[text]:'untoasted171'
 table public.toasted_copy: INSERT: id[pg_catalog.int4]:174 data[text]:'untoasted172'
 table public.toasted_copy: INSERT: id[pg_catalog.int4]:175 data[text]:'untoasted173'
 table public.toasted_copy: INSERT: id[pg_catalog.int4]:176 data[text]:'untoasted174'
 table public.toasted_copy: INSERT: id[pg_catalog.int4]:177 data[text]:'untoasted175'
 table public.toasted_copy: INSERT: id[pg_catalog.int4]:178 data[text]:'untoasted176'
 table public.toasted_copy: INSERT: id[pg_catalog.int4]:179 data[text]:'untoasted177'
 table public.toasted_copy: INSERT: id[pg_catalog.int4]:180 data[text]:'untoasted178'
 table public.toasted_copy: INSERT: id[pg_catalog.int4]:181 data[text]:'untoasted179'
 table public.toasted_copy: INSERT: id[pg_catalog.int4]:182 data[text]:'untoasted180'
 table public.toasted_copy: INSERT: id[pg_catalog.int4]:183 data[text]:'untoasted181'
 table public.toasted_copy: INSERT: id[pg_catalog.int4]:184 data[text]:'untoasted182'
 table public.toasted_copy: INSERT: id[pg_catalog.int4]:185 data[text]:'untoasted183'
 table public.toasted_copy: INSERT: id[pg_catalog.int4]:186 data[text]:'untoasted184'
 table public.toasted_copy: INSERT: id[pg_catalog.int4]:187 data[text]:'untoasted185'
 table public.toasted_copy: INSERT: id[pg_catalog.int4]:188 data[text]:'untoasted186'
 table public.toasted_copy: INSERT: id[pg_catalog.int4]:189 data[text]:'untoasted187'
 table public.toasted_copy: INSERT: id[pg_catalog.int4]:190 data[text]:'untoasted188'
 table public.toasted_copy: INSERT: id[pg_catalog.int4]:191 data[text]:'untoasted189'
 table public.toasted_copy: INSERT: id[pg_catalog.int4]:192 data[text]:'untoasted190'
 table public.toasted_copy: INSERT: id[pg_catalog.int4]:193 data[text]:'untoasted191'
 table public.toasted_copy: INSERT: id[pg_catalog.int4]:194 data[text]:'untoasted192'
 table public.toasted_copy: INSERT: id[pg_catalog.int4]:195 data[text]:'untoasted193'
 table public.toasted_copy: INSERT: id[pg_catalog.int4]:196 data[text]:'untoasted194'
 table public.toasted_copy: INSERT: id[pg_catalog.int4]:197 data[text]:'untoasted195'
 table public.toasted_copy: INSERT: id[pg_catalog.int4]:198 data[text]:'untoasted196'
 table public.toasted_copy: INSERT: id[pg_catalog.int4]:199 data[text]:'untoasted197'
 table public.toasted_copy: INSERT: id[pg_catalog.int4]:200 data[text]:'untoasted198'
 table public.toasted_copy: INSERT: id[pg_catalog.int4]:201 data[text]:'toasted3-123456789012345678901234567890123456789012345678901234567890123456789012345678901234567890123456789012345678901234567890
 table public.toasted_copy: INSERT: id[pg_catalog.int4]:202 data[text]:'untoasted199'
 table public.toasted_copy: INSERT: id[pg_catalog.int4]:203 data[text]:'untoasted200'
 COMMIT
(235 rows)

-- test we can decode "old" tuples bigger than the max heap tuple size correctly
DROP TABLE IF EXISTS toasted_several;
NOTICE:  table "toasted_several" does not exist, skipping
CREATE TABLE toasted_several (
    id serial unique not null,
    toasted_key text primary key,
    toasted_col1 text,
    toasted_col2 text
);
ALTER TABLE toasted_several REPLICA IDENTITY FULL;
ALTER TABLE toasted_several ALTER COLUMN toasted_key SET STORAGE EXTERNAL;
ALTER TABLE toasted_several ALTER COLUMN toasted_col1 SET STORAGE EXTERNAL;
ALTER TABLE toasted_several ALTER COLUMN toasted_col2 SET STORAGE EXTERNAL;
-- Change the storage of the index back to EXTENDED, separately from
-- the table.  This is currently not doable via DDL, but it is
-- supported internally.
UPDATE pg_attribute SET attstorage = 'x' WHERE attrelid = 'toasted_several_pkey'::regclass AND attname = 'toasted_key';
INSERT INTO toasted_several(toasted_key) VALUES(repeat('9876543210', 10000));
SELECT pg_column_size(toasted_key) > 2^16 FROM toasted_several;
 ?column? 
----------
 t
(1 row)

SELECT regexp_replace(data, '^(.{100}).*(.{100})$', '\1..\2') FROM pg_logical_slot_peek_changes('regression_slot', NULL, NULL, 'include-xids', '0', 'skip-empty-xacts', '1');
                                                                                               regexp_replace                                                                                               
------------------------------------------------------------------------------------------------------------------------------------------------------------------------------------------------------------
 BEGIN
 table public.toasted_several: INSERT: id[pg_catalog.int4]:1 toasted_key[text]:'987654321098765432109..098765432109876543210987654321098765432109876543210' toasted_col1[text]:null toasted_col2[text]:null
 COMMIT
(3 rows)

-- test update of a toasted key without changing it
UPDATE toasted_several SET toasted_col1 = toasted_key;
UPDATE toasted_several SET toasted_col2 = toasted_col1;
SELECT regexp_replace(data, '^(.{100}).*(.{100})$', '\1..\2') FROM pg_logical_slot_get_changes('regression_slot', NULL, NULL, 'include-xids', '0', 'skip-empty-xacts', '1');
                                                                                               regexp_replace                                                                                               
------------------------------------------------------------------------------------------------------------------------------------------------------------------------------------------------------------
 BEGIN
 table public.toasted_several: INSERT: id[pg_catalog.int4]:1 toasted_key[text]:'987654321098765432109..098765432109876543210987654321098765432109876543210' toasted_col1[text]:null toasted_col2[text]:null
 COMMIT
 BEGIN
 table public.toasted_several: UPDATE: old-key: id[pg_catalog.int4]:1 toasted_key[text]:'987654321098..432109876543210987654321098765432109876543210987654321098765432109876543210' toasted_col2[text]:null
 COMMIT
 BEGIN
 table public.toasted_several: UPDATE: old-key: id[pg_catalog.int4]:1 toasted_key[text]:'987654321098..876543210987654321098765432109876543210987654321098765432109876543210987654321098765432109876543210'
 COMMIT
(9 rows)

/*
 * update with large tuplebuf, in a transaction large enough to force to spool to disk
 */
BEGIN;
INSERT INTO toasted_several(toasted_key) SELECT * FROM generate_series(1, 10234);
UPDATE toasted_several SET toasted_col1 = toasted_col2 WHERE id = 1;
DELETE FROM toasted_several WHERE id = 1;
COMMIT;
DROP TABLE toasted_several;
SELECT regexp_replace(data, '^(.{100}).*(.{100})$', '\1..\2') FROM pg_logical_slot_get_changes('regression_slot', NULL, NULL, 'include-xids', '0', 'skip-empty-xacts', '1')
WHERE data NOT LIKE '%INSERT: %';
                                                                                               regexp_replace                                                                                               
------------------------------------------------------------------------------------------------------------------------------------------------------------------------------------------------------------
 BEGIN
 table public.toasted_several: UPDATE: old-key: id[pg_catalog.int4]:1 toasted_key[text]:'987654321098..7654321098765432109876543210987654321098765432109876543210' toasted_col2[text]:unchanged-toast-datum
 table public.toasted_several: DELETE: id[pg_catalog.int4]:1 toasted_key[text]:'987654321098765432109..876543210987654321098765432109876543210987654321098765432109876543210987654321098765432109876543210'
 COMMIT
(4 rows)

/*
 * Test decoding relation rewrite with toast. The insert into tbl2 within the
 * same transaction is there to check that there is no remaining toast_hash not
 * being reset.
 */
CREATE TABLE tbl1 (a INT, b TEXT);
CREATE TABLE tbl2 (a INT);
ALTER TABLE tbl1 ALTER COLUMN b SET STORAGE EXTERNAL;
BEGIN;
INSERT INTO tbl1 VALUES(1, repeat('a', 4000)) ;
ALTER TABLE tbl1 ADD COLUMN id serial primary key;
INSERT INTO tbl2 VALUES(1);
commit;
SELECT substr(data, 1, 200) FROM pg_logical_slot_get_changes('regression_slot', NULL, NULL, 'include-xids', '0', 'skip-empty-xacts', '1');
                                                                                                  substr                                                                                                  
----------------------------------------------------------------------------------------------------------------------------------------------------------------------------------------------------------
 BEGIN
 table public.tbl1: INSERT: a[pg_catalog.int4]:1 b[text]:'aaaaaaaaaaaaaaaaaaaaaaaaaaaaaaaaaaaaaaaaaaaaaaaaaaaaaaaaaaaaaaaaaaaaaaaaaaaaaaaaaaaaaaaaaaaaaaaaaaaaaaaaaaaaaaaaaaaaaaaaaaaaaaaaaaaaaaaaaaaaaaa
 table public.tbl2: INSERT: a[pg_catalog.int4]:1
 COMMIT
(4 rows)

SELECT pg_drop_replication_slot('regression_slot');
 pg_drop_replication_slot 
--------------------------
 
(1 row)

